2021-04-03 00:00:00,УЭ ,ЦСО ГТТ,Шлифовальный станок,Эксплуатационный износ ,Замена,УЭ  ЦСО ГТТ Шлифовальный станок Эксплуатационный износ ,Замена
2021-04-04 00:00:00,УЭ ,ЦСО ГТТ,Розетка 380В,Механическое повреждение,Замена,УЭ  ЦСО ГТТ Розетка 380В Механическое повреждение,Замена
2021-04-05 00:00:00,УЭ ,Столовая АБК,Освещение,Эксплуатационный износ ,Замена,УЭ  Столовая АБК Освещение Эксплуатационный износ ,Замена
2021-04-06 00:00:00,УЭ ,Цеппелин,Балок мастера,"Ослабление контактов, увеличение нагрузки ввиду морозов","Замена, ревизия, протяжка","УЭ  Цеппелин Балок мастера Ослабление контактов, увеличение нагрузки ввиду морозов","Замена, ревизия, протяжка"
2021-04-07 00:00:00,УЭ ,"ВЛЗ №3.2 6кВ ""ГДЭС ОФ""",nan,nan,nan,"УЭ  ВЛЗ №3.2 6кВ ""ГДЭС ОФ"" nan nan",nan
2021-04-08 00:00:00,УЭ ,"ВЛЗ №3.2 6кВ ""ГДЭС ОФ""",nan,nan,nan,"УЭ  ВЛЗ №3.2 6кВ ""ГДЭС ОФ"" nan nan",nan
2021-04-25 00:00:00,УЭ ,АЗС ТТ,Уличное освещение ,Эксплуатационный износ ,Замена,УЭ  АЗС ТТ Уличное освещение  Эксплуатационный износ ,Замена
2021-05-06 00:00:00,УЭ ,ВЛЗ№20 ,Линейный разъединитель   Рх20,Отсутствие приемных изоляторов,"Ривизия разъединителя, установка приемных изоляторов",УЭ  ВЛЗ№20  Линейный разъединитель   Рх20 Отсутствие приемных изоляторов,"Ривизия разъединителя, установка приемных изоляторов"
2021-05-07 00:00:00,УЭ ,ТП-101о,Трансформатор ,nan,демонтаж,УЭ  ТП-101о Трансформатор  nan,демонтаж
2021-05-08 00:00:00,УЭ ,ТП-101о,Трансформатор ,nan,монтаж,УЭ  ТП-101о Трансформатор  nan,монтаж
2021-05-09 00:00:00,УЭ ,Р5В74а,Разьеденитель,nan,nan,УЭ  Р5В74а Разьеденитель nan,nan
2021-05-10 00:00:00,УЭ ,Р5В74а,Разьеденитель,nan,ремонт,УЭ  Р5В74а Разьеденитель nan,ремонт
2021-05-12 00:00:00,УЭ ,ТП20к,Подстанция,nan,заплонировать сварочные работы,УЭ  ТП20к Подстанция nan,заплонировать сварочные работы
2021-05-14 00:00:00,УЭ ,АБК и общежития,Светильни выход,Эксплуатационный износ ,Замена,УЭ  АБК и общежития Светильни выход Эксплуатационный износ ,Замена
2021-05-17 00:00:00,УЭ ,Тп-92о,Привод разьеденителя   РВ9-1б,Эксплуатационный износ ,ремонт,УЭ  Тп-92о Привод разьеденителя   РВ9-1б Эксплуатационный износ ,ремонт
2021-05-18 00:00:00,УЭ ,ВЛЗ №11 6кВ,Кабель 6кВ на ПНС-1 ввод №2,Низкое сопртивление изоляции,Разделка концевой муфты,УЭ  ВЛЗ №11 6кВ Кабель 6кВ на ПНС-1 ввод №2 Низкое сопртивление изоляции,Разделка концевой муфты
2021-05-19 00:00:00,УЭ ,ЦСО ГТТ,Шиномонтажный станок,Сработка реле,Сброс реле,УЭ  ЦСО ГТТ Шиномонтажный станок Сработка реле,Сброс реле
2021-05-20 00:00:00,УЭ ,РБП,LED прожекторы,Эксплуатационный износ ,Восстановление ,УЭ  РБП LED прожекторы Эксплуатационный износ ,Восстановление 
2021-05-21 00:00:00,УЭ ,РБП,Освещение балка,Эксплуатационный износ ,Замена,УЭ  РБП Освещение балка Эксплуатационный износ ,Замена
2021-05-22 00:00:00,УЭ ,Столовая АБК,Посудомойка,Попадание остатков пищи,Устранение инородных предметов,УЭ  Столовая АБК Посудомойка Попадание остатков пищи,Устранение инородных предметов
2021-05-23 00:00:00,УЭ ,РБП,Пускатель ПМ-12 на вибраторе,Эксплуатационный износ ,Замена,УЭ  РБП Пускатель ПМ-12 на вибраторе Эксплуатационный износ ,Замена
2021-05-24 00:00:00,УЭ ,РБП,Вводной АВ буровой установки,Не соотвествие настроек новому оборудованию ,Настройка уставок,УЭ  РБП Вводной АВ буровой установки Не соотвествие настроек новому оборудованию ,Настройка уставок
2021-05-25 00:00:00,УЭ ,"ВЛИ 0.4 ""Освещение посёлка за АБК""",Уличные светильники,Слом крепежа от порывов ветра,Монтаж кронштейнов к опорам,"УЭ  ВЛИ 0.4 ""Освещение посёлка за АБК"" Уличные светильники Слом крепежа от порывов ветра",Монтаж кронштейнов к опорам
2021-05-26 00:00:00,УЭ ,Столовая АБК,Транспортёрная автоматическая лента,Эксплуатационный износ механических частей,Подключение и проверка исправности транспортёрной ленты,УЭ  Столовая АБК Транспортёрная автоматическая лента Эксплуатационный износ механических частей,Подключение и проверка исправности транспортёрной ленты
2021-05-27 00:00:00,УЭ ,Посёлок,Освещение туалета 1/38,Эксплуатационный износ ,Замена,УЭ  Посёлок Освещение туалета 1/38 Эксплуатационный износ ,Замена
2021-05-28 00:00:00,УЭ ,ЦСО ГТТ,Освещение,Эксплуатационный износ ,Замена,УЭ  ЦСО ГТТ Освещение Эксплуатационный износ ,Замена
2021-05-29 00:00:00,УЭ ,Столовая Посёлок,Линия раздачи,Эксплуатационный износ ,Отключение,УЭ  Столовая Посёлок Линия раздачи Эксплуатационный износ ,Отключение
2021-05-30 00:00:00,УЭ ,АБК,Туалет,Эксплуатационный износ ,Замена,УЭ  АБК Туалет Эксплуатационный износ ,Замена
2021-05-31 00:00:00,УЭ ,Отвал №2,Мачта освещения,Перенос мачты,Прокладка кабеля и подключение к ТП-26,УЭ  Отвал №2 Мачта освещения Перенос мачты,Прокладка кабеля и подключение к ТП-26
2021-06-01 00:00:00,УЭ ,КОС-350,ПЧ,Эксплуатационный износ ,Замена,УЭ  КОС-350 ПЧ Эксплуатационный износ ,Замена
2021-06-02 00:00:00,УЭ ,Столовая посёлка,Стиральная машина,Эксплуатационный износ ,Замена,УЭ  Столовая посёлка Стиральная машина Эксплуатационный износ ,Замена
2021-06-03 00:00:00,УЭ ,ЦСО ГТТ,Освещение,Эксплуатационный износ ,Замена,УЭ  ЦСО ГТТ Освещение Эксплуатационный износ ,Замена
2021-06-04 00:00:00,УЭ ,ЦСО ГТТ,Розетки 380В,Механическое повреждение,Замена,УЭ  ЦСО ГТТ Розетки 380В Механическое повреждение,Замена
2021-06-05 00:00:00,УЭ ,Столовая посёлка,Линия раздачи,Эксплуатационный износ ,Замена,УЭ  Столовая посёлка Линия раздачи Эксплуатационный износ ,Замена
2021-06-06 00:00:00,УЭ ,АБК,Розетки 220В в лаборатории,Отключение после переключений на ТП-59п,Поиск и включение АВ,УЭ  АБК Розетки 220В в лаборатории Отключение после переключений на ТП-59п,Поиск и включение АВ
2021-06-07 00:00:00,УЭ ,РБП,Разъёмы питания в вагон-доме,Перегрев нулевого контакта,Замена,УЭ  РБП Разъёмы питания в вагон-доме Перегрев нулевого контакта,Замена
2021-06-08 00:00:00,УЭ ,Посёлок,Освещение,Эксплуатационный износ ,Замена,УЭ  Посёлок Освещение Эксплуатационный износ ,Замена
2021-06-09 00:00:00,УЭ ,"Ангар ""Цеппелин""",Кран-балка,Эксплуатационный износ ,Снятие/ремонт/установка,"УЭ  Ангар ""Цеппелин"" Кран-балка Эксплуатационный износ ",Снятие/ремонт/установка
2021-06-10 00:00:00,УЭ ,РБП,Сварочный аппарат,Эксплуатационный износ ,Замена,УЭ  РБП Сварочный аппарат Эксплуатационный износ ,Замена
2021-06-11 00:00:00,УЭ ,ЦСО ГТТ,Освещение станка,Эксплуатационный износ ,Замена,УЭ  ЦСО ГТТ Освещение станка Эксплуатационный износ ,Замена
2021-06-12 00:00:00,УЭ ,Столовая посёлка,Линия раздачи,Эксплуатационный износ ,Замена,УЭ  Столовая посёлка Линия раздачи Эксплуатационный износ ,Замена
2021-06-13 00:00:00,УЭ ,ЦСО ГТТ,Розетки 220В,Механическое повреждение,Замена,УЭ  ЦСО ГТТ Розетки 220В Механическое повреждение,Замена
2021-06-14 00:00:00,УЭ ,РМЦ,Контейнер,Эксплуатационный износ ,Демонтаж/монтаж ,УЭ  РМЦ Контейнер Эксплуатационный износ ,Демонтаж/монтаж 
2021-06-15 00:00:00,УЭ ,КОС 350,Компрессор,Эксплуатационный износ ,Замена,УЭ  КОС 350 Компрессор Эксплуатационный износ ,Замена
2021-06-16 00:00:00,УЭ ,РБП,Сварочный аппарат,Механическое повреждение,Усиление корпуса,УЭ  РБП Сварочный аппарат Механическое повреждение,Усиление корпуса
2021-06-17 00:00:00,УЭ ,РБП,Сварочный аппарат Дуга,Эксплуатационный износ ,Замена,УЭ  РБП Сварочный аппарат Дуга Эксплуатационный износ ,Замена
2021-06-18 00:00:00,УЭ ,РМЦ,Подъём ворот,Эксплуатационный износ ,Замена,УЭ  РМЦ Подъём ворот Эксплуатационный износ ,Замена
2021-06-19 00:00:00,УЭ ,УЭ ЦСОЭ,УШМ,Эксплуатационный износ ,Замена,УЭ  УЭ ЦСОЭ УШМ Эксплуатационный износ ,Замена
2021-06-20 00:00:00,УЭ ,ЦСО ГТТ,Эл. Питание агрегатного и сварочного цехов,Эксплуатационный износ ,Ремонт,УЭ  ЦСО ГТТ Эл. Питание агрегатного и сварочного цехов Эксплуатационный износ ,Ремонт
2021-06-21 00:00:00,УЭ ,ВЛ 6кВ Р17,ТП-110о,Межвитковое замыкание обмотки тр-ра,Отключение ТП,УЭ  ВЛ 6кВ Р17 ТП-110о Межвитковое замыкание обмотки тр-ра,Отключение ТП
2021-06-22 00:00:00,УЭ ,Горный участок,Освещение,Эксплуатационный износ ,Замена,УЭ  Горный участок Освещение Эксплуатационный износ ,Замена
2021-06-23 00:00:00,УЭ ,Столовая АБК,Эл. Плита,Эксплуатационный износ ,Замена,УЭ  Столовая АБК Эл. Плита Эксплуатационный износ ,Замена
2021-06-24 00:00:00,УЭ ,УЭ ЦСОЭ,ТП-81к,Вновь смонтированный,Подключение и проверка исправности ,УЭ  УЭ ЦСОЭ ТП-81к Вновь смонтированный,Подключение и проверка исправности 
2021-06-25 00:00:00,УЭ ,АБК,Туалет,Эксплуатационный износ ,Ремонт,УЭ  АБК Туалет Эксплуатационный износ ,Ремонт
2021-06-26 00:00:00,УЭ ,ХБЦ,Туалет в посёлке за АБК,Эксплуатационный износ ,Ремонт,УЭ  ХБЦ Туалет в посёлке за АБК Эксплуатационный износ ,Ремонт
2021-06-27 00:00:00,УЭ ,ХБЦ,Общежитие 7/32,Эксплуатационный износ ,Ремонт,УЭ  ХБЦ Общежитие 7/32 Эксплуатационный износ ,Ремонт
2021-06-28 00:00:00,УЭ ,РМЦ,Эл. Питание ангара,Эксплуатационный износ ,Ремонт,УЭ  РМЦ Эл. Питание ангара Эксплуатационный износ ,Ремонт
2021-06-29 00:00:00,УЭ ,Столовая АБК,Освещение душевой,Эксплуатационный износ ,Ремонт,УЭ  Столовая АБК Освещение душевой Эксплуатационный износ ,Ремонт
2021-06-30 00:00:00,УЭ ,Столовая Посёлка,Освещение душевой,Эксплуатационный износ ,Ремонт,УЭ  Столовая Посёлка Освещение душевой Эксплуатационный износ ,Ремонт
2021-07-01 00:00:00,УЭ ,УЭ ЦСОЭ,ТП-20,Эксплуатационный износ ,Ремонт,УЭ  УЭ ЦСОЭ ТП-20 Эксплуатационный износ ,Ремонт
2021-07-03 00:00:00,УЭ ,Кран мостовой,Кабельно-проводниковая продукция,Непреднамеренные ошибки технологического персонала,Восстановление схемы питания,УЭ  Кран мостовой Кабельно-проводниковая продукция Непреднамеренные ошибки технологического персонала,Восстановление схемы питания
2021-07-04 00:00:00,УЭ ,Уличное освещение,Осветительная арматура,Эксплуатационный износ ,Замена светильников,УЭ  Уличное освещение Осветительная арматура Эксплуатационный износ ,Замена светильников
2021-07-05 00:00:00,УЭ ,Столовая АБК,Автоматический выключатель,Неисправность ,Исключение неисправного оборудования из сети,УЭ  Столовая АБК Автоматический выключатель Неисправность ,Исключение неисправного оборудования из сети
2021-07-06 00:00:00,УЭ ,Уличное освещение,Осветительная арматура,Эксплуатационный износ ,Замена светильников,УЭ  Уличное освещение Осветительная арматура Эксплуатационный износ ,Замена светильников
2021-07-07 00:00:00,УЭ ,Уличное освещение,Осветительная арматура,Эксплуатационный износ ,Замена светильников,УЭ  Уличное освещение Осветительная арматура Эксплуатационный износ ,Замена светильников
2021-07-10 00:00:00,УЭ ,Столовая АБК,Освещение помещения,Эксплуатационный износ ,Замена светильника,УЭ  Столовая АБК Освещение помещения Эксплуатационный износ ,Замена светильника
2021-07-11 00:00:00,УЭ ,Столовая Посёлка,Очистка воздуха помещения,Эксплуатационный износ ,Замена УФ ламп,УЭ  Столовая Посёлка Очистка воздуха помещения Эксплуатационный износ ,Замена УФ ламп
2021-07-12 00:00:00,УЭ ,Столовая АБК,Автоматический выключатель,Неисправность ,Замена неисправной розетки 220В,УЭ  Столовая АБК Автоматический выключатель Неисправность ,Замена неисправной розетки 220В
2021-07-13 00:00:00,УЭ ,Столовая АБК,Хлебопечка,Неисправность ,Замена отгоревшего нулевого контакта,УЭ  Столовая АБК Хлебопечка Неисправность ,Замена отгоревшего нулевого контакта
2021-07-14 00:00:00,УЭ ,АБК,Освещение помещения,Эксплуатационный износ ,Замена светильника,УЭ  АБК Освещение помещения Эксплуатационный износ ,Замена светильника
2021-07-16 00:00:00,УЭ ,Общежитие №4,Щитовое оборудование,Неисправность ,Замена АВНН,УЭ  Общежитие №4 Щитовое оборудование Неисправность ,Замена АВНН
2021-07-17 00:00:00,УЭ ,АБК,Освещение помещения,Эксплуатационный износ ,Замена светильника,УЭ  АБК Освещение помещения Эксплуатационный износ ,Замена светильника
2021-07-18 00:00:00,УЭ ,Столовая Посёлка,Посудомойка,Эксплуатационный износ ,"Снятие, ремонт, установка катушки клапана",УЭ  Столовая Посёлка Посудомойка Эксплуатационный износ ,"Снятие, ремонт, установка катушки клапана"
2021-07-21 00:00:00,УЭ ,Столовая Посёлка,Варочная панель,Эксплуатационный износ ,Замена ТЭНа,УЭ  Столовая Посёлка Варочная панель Эксплуатационный износ ,Замена ТЭНа
2021-07-22 00:00:00,УЭ ,ЦСО ГТТ,Электротехнологическое оборудование,Непреднамеренные ошибки технологического персонала,Ремонт кабеля,УЭ  ЦСО ГТТ Электротехнологическое оборудование Непреднамеренные ошибки технологического персонала,Ремонт кабеля
2021-07-23 00:00:00,УЭ ,АБК,Освещение помещения,Эксплуатационный износ ,Замена светильника,УЭ  АБК Освещение помещения Эксплуатационный износ ,Замена светильника
2021-07-24 00:00:00,УЭ ,ЦСО ГТТ,Освещение помещения,Эксплуатационный износ ,Замена ламп,УЭ  ЦСО ГТТ Освещение помещения Эксплуатационный износ ,Замена ламп
2021-07-25 00:00:00,УЭ ,АБК,Освещение помещения,Эксплуатационный износ ,Замена светильника,УЭ  АБК Освещение помещения Эксплуатационный износ ,Замена светильника
2021-07-26 00:00:00,УЭ ,Общежитие №3,Освещение помещения,Эксплуатационный износ ,Замена светильника,УЭ  Общежитие №3 Освещение помещения Эксплуатационный износ ,Замена светильника
2021-07-27 00:00:00,УЭ ,Столовая промплощадки,Очистка воздуха помещения,Эксплуатационный износ ,Замена УФ ламп,УЭ  Столовая промплощадки Очистка воздуха помещения Эксплуатационный износ ,Замена УФ ламп
2021-07-28 00:00:00,УЭ ,АБК,Очистка воздуха помещения,Эксплуатационный износ ,Замена УФ ламп,УЭ  АБК Очистка воздуха помещения Эксплуатационный износ ,Замена УФ ламп
2021-07-29 00:00:00,УЭ ,Мойка ТТ,Электротехнологическое оборудование,Непреднамеренные ошибки технологического персонала,Ремонт мойки,УЭ  Мойка ТТ Электротехнологическое оборудование Непреднамеренные ошибки технологического персонала,Ремонт мойки
2021-07-30 00:00:00,УЭ ,Кузнечевский ПУ,Уличное освещение,Эксплуатационный износ ,Замена светильников,УЭ  Кузнечевский ПУ Уличное освещение Эксплуатационный износ ,Замена светильников
2021-08-01 00:00:00,УЭ ,Общежитие №1,Освещение помещения,Эксплуатационный износ ,Протяжка контактной группы,УЭ  Общежитие №1 Освещение помещения Эксплуатационный износ ,Протяжка контактной группы
2021-08-02 00:00:00,УЭ ,Общежитие №3,Освещение помещения,Эксплуатационный износ ,Замена ламп и светильника,УЭ  Общежитие №3 Освещение помещения Эксплуатационный износ ,Замена ламп и светильника
2021-08-02 00:00:00,УЭ ,Общежитие №5,Освещение помещения,Эксплуатационный износ ,Замена ламп и светильника,УЭ  Общежитие №5 Освещение помещения Эксплуатационный износ ,Замена ламп и светильника
2021-08-04 00:00:00,УЭ ,Вагон-дом,Освещение помещения,Эксплуатационный износ ,Замена светильников,УЭ  Вагон-дом Освещение помещения Эксплуатационный износ ,Замена светильников
2021-08-05 00:00:00,УЭ ,Столовая АБК,Освещение помещения,Эксплуатационный износ ,Ремонт светодиодной ленты,УЭ  Столовая АБК Освещение помещения Эксплуатационный износ ,Ремонт светодиодной ленты
2021-08-06 00:00:00,УЭ ,Столовая посёлка,Раздача питания,Эксплуатационный износ ,"Замена наконечника, ревизия контактной группы",УЭ  Столовая посёлка Раздача питания Эксплуатационный износ ,"Замена наконечника, ревизия контактной группы"
2021-08-07 00:00:00,УЭ ,АБК,Освещение помещения,Эксплуатационный износ ,Демонтаж светильника,УЭ  АБК Освещение помещения Эксплуатационный износ ,Демонтаж светильника
2021-08-12 00:00:00,УЭ ,АБК,Освещение помещения,Эксплуатационный износ ,Демонтаж светильника,УЭ  АБК Освещение помещения Эксплуатационный износ ,Демонтаж светильника
