Дата,Участок,Наименование оборудования,Узел,Описание коренной причины,Работы по устранению неисправностей,description,recommendation
2020-04-09 00:00:00,ЭТЛ,ШУ1,Система бесперибойного питания платформы автоматизации    S7-300,Низкое напряжение аккумуляторов ИБП,Замена аккумуляторов ИБП,ЭТЛ ШУ1 Система бесперибойного питания платформы автоматизации    S7-300 Низкое напряжение аккумуляторов ИБП,Замена аккумуляторов ИБП
2020-04-09 00:00:00,ЭТЛ,ШУ2,Система автоматизации    S7-300,Отказ электронной платы блока питания,Замена стабилизированного блока питания PS307; восстановление схемы заземления согласно руководства на оборудование,ЭТЛ ШУ2 Система автоматизации    S7-300 Отказ электронной платы блока питания,Замена стабилизированного блока питания PS307; восстановление схемы заземления согласно руководства на оборудование
2020-04-15 00:00:00,ЭТЛ,Термомаслянная котельная,Система автоматического заполнения расходного бака дизельного топлива термомаслянной котельной,Разрыв внутренней мембраны,Замена мембраны электромагнитного клапана,ЭТЛ Термомаслянная котельная Система автоматического заполнения расходного бака дизельного топлива термомаслянной котельной Разрыв внутренней мембраны,Замена мембраны электромагнитного клапана
2020-04-21 00:00:00,ЭТЛ,ШУ Грантол,Система управления,Отказ электронной платы контроллера,Заказан новый для замены; заказан кабель для программирования,ЭТЛ ШУ Грантол Система управления Отказ электронной платы контроллера,Заказан новый для замены; заказан кабель для программирования
2020-05-17 00:00:00,ЭТЛ,Собственные нужды ДГУ1,Система управления задвижкой на входе котла СУТ,Отказ электронной платы управления привода,Установка более надежного привода Auma SG 05.1-F07,ЭТЛ Собственные нужды ДГУ1 Система управления задвижкой на входе котла СУТ Отказ электронной платы управления привода,Установка более надежного привода Auma SG 05.1-F07
2020-05-18 00:00:00,ЭТЛ,Собственные нужды ДГУ2,Система учета количества кКал на выходе котла СУТ,Отказ электронной платы теплосчетчика,Заказан новый для замены,ЭТЛ Собственные нужды ДГУ2 Система учета количества кКал на выходе котла СУТ Отказ электронной платы теплосчетчика,Заказан новый для замены
2020-05-27 00:00:00,ЭТЛ,ШУ1,Система обогрева трубопроводов,Отказ электронной платы регулятора,"Рекламация, замена/ремонт по гарантии",ЭТЛ ШУ1 Система обогрева трубопроводов Отказ электронной платы регулятора,"Рекламация, замена/ремонт по гарантии"
2020-06-03 00:00:00,ЭТЛ,Собственные нужды ДГУ2,Система управления задвижкой на входе котла СУТ,Отказ электронной платы управления привода,Установка более надежного привода Auma SG 05.1-F07,ЭТЛ Собственные нужды ДГУ2 Система управления задвижкой на входе котла СУТ Отказ электронной платы управления привода,Установка более надежного привода Auma SG 05.1-F07
2020-06-10 00:00:00,ЭТЛ,Бустерный модуль,Система подачи МТ,Облом шестерни,"Рекламация, замена/ремонт по гарантии",ЭТЛ Бустерный модуль Система подачи МТ Облом шестерни,"Рекламация, замена/ремонт по гарантии"
2020-06-29 00:00:00,ЭТЛ,ДГУ3,Ситсема безопасности ДГУ,Повреждение кабеля подключения,Замена реле давления и кабеля подключения,ЭТЛ ДГУ3 Ситсема безопасности ДГУ Повреждение кабеля подключения,Замена реле давления и кабеля подключения
2020-07-04 00:00:00,ЭТЛ,ШПА1,Система контроля загазованности,Неестественные показания газосигнализатора,"Рекламация, замена/ремонт по гарантии",ЭТЛ ШПА1 Система контроля загазованности Неестественные показания газосигнализатора,"Рекламация, замена/ремонт по гарантии"
2020-07-09 00:00:00,ЭТЛ,ДГУ2,Система запуска,Низкое напряжение АКБ,Замена 4 АКБ,ЭТЛ ДГУ2 Система запуска Низкое напряжение АКБ,Замена 4 АКБ
2020-07-11 00:00:00,ЭТЛ,ДГУ3,Система контроля подшипников,Повреждение кабеля подключения,Замена поврежденного участка кабеля,ЭТЛ ДГУ3 Система контроля подшипников Повреждение кабеля подключения,Замена поврежденного участка кабеля
2020-07-13 00:00:00,ЭТЛ,ДГУ2,Система контроля состояние ДГУ,Повреждение кабеля подключения,Замена поврежденного участка кабеля,ЭТЛ ДГУ2 Система контроля состояние ДГУ Повреждение кабеля подключения,Замена поврежденного участка кабеля
2020-07-26 00:00:00,ЭТЛ,Собственные нужды ДГУ2,Система управления задвижкой на входе котла СУТ,Обрыв в чувствиетльном элементе,Замена неисправных датчиков,ЭТЛ Собственные нужды ДГУ2 Система управления задвижкой на входе котла СУТ Обрыв в чувствиетльном элементе,Замена неисправных датчиков
2020-08-06 00:00:00,ЭТЛ,ДГУ3,Система входа ДГУ в параллельную работу,Недостаточное усилие срабатывания катушки,Замена электромагнитной катушки включения секционного автомата,ЭТЛ ДГУ3 Система входа ДГУ в параллельную работу Недостаточное усилие срабатывания катушки,Замена электромагнитной катушки включения секционного автомата
2020-08-05 00:00:00,ЭТЛ,Собственные нужды ДГУ3,Система управления задвижкой на входе котла СУТ,Отказ электронной платы управления привода,Установка более надежного привода Auma SG 05.1-F07,ЭТЛ Собственные нужды ДГУ3 Система управления задвижкой на входе котла СУТ Отказ электронной платы управления привода,Установка более надежного привода Auma SG 05.1-F07
2020-08-11 00:00:00,ЭТЛ,Собственные нужды ДГУ2,Система управления задвижкой на входе котла СУТ,Обрыв в чувствиетльном элементе,Замена 4 неисправных датчиков,ЭТЛ Собственные нужды ДГУ2 Система управления задвижкой на входе котла СУТ Обрыв в чувствиетльном элементе,Замена 4 неисправных датчиков
2020-09-07 00:00:00,ЭТЛ,Ультрозвуковая ванна малая,Ситстема ультрозвуковой чистки,Рассыпались ультрозвуковые генераторы,"Рекламация, замена/ремонт по гарантии",ЭТЛ Ультрозвуковая ванна малая Ситстема ультрозвуковой чистки Рассыпались ультрозвуковые генераторы,"Рекламация, замена/ремонт по гарантии"
2020-09-08 00:00:00,ЭТЛ,ШУ3,Система обогрева трубопроводов,Отказ электронной платы у      3-ех регуляторов,"Рекламация, замена/ремонт по гарантии",ЭТЛ ШУ3 Система обогрева трубопроводов Отказ электронной платы у      3-ех регуляторов,"Рекламация, замена/ремонт по гарантии"
2020-09-09 00:00:00,ЭТЛ,ШУВ2,Система вентиляции,Обрыв в чувствиетльном элементе,Замена неисправного датчика,ЭТЛ ШУВ2 Система вентиляции Обрыв в чувствиетльном элементе,Замена неисправного датчика
2020-09-10 00:00:00,ЭТЛ,ШОТ,Выпрямительная система,Отказ электронной платы контроллера,Замена на более современный Cordex CXC HP,ЭТЛ ШОТ Выпрямительная система Отказ электронной платы контроллера,Замена на более современный Cordex CXC HP
2020-09-17 00:00:00,ЭТЛ,Собственные нужды ДГУ5,Система управления задвижкой на входе котла СУТ,Отказ электронной платы управления привода,Установка более надежного привода Auma SG 05.1-F07,ЭТЛ Собственные нужды ДГУ5 Система управления задвижкой на входе котла СУТ Отказ электронной платы управления привода,Установка более надежного привода Auma SG 05.1-F07
2020-09-20 00:00:00,ЭТЛ,Компрессор Sauer №1,Система сброса кондесата,Отказ электромагнитной катушки клапана,Замена элетромагнитной катушки,ЭТЛ Компрессор Sauer №1 Система сброса кондесата Отказ электромагнитной катушки клапана,Замена элетромагнитной катушки
2020-09-22 00:00:00,ЭТЛ,ШУ ДГУ2,Система управления ДГУ,Перегорел,Замена предохранителя,ЭТЛ ШУ ДГУ2 Система управления ДГУ Перегорел,Замена предохранителя
2020-09-22 00:00:00,ЭТЛ,ШУ1,Система автоматизации    S7-300,Режим останов без аврийной индикации,Запуск в работу контроллера,ЭТЛ ШУ1 Система автоматизации    S7-300 Режим останов без аврийной индикации,Запуск в работу контроллера
2020-09-22 00:00:00,ЭТЛ,ШУ ДГУ4,Система управления ДГУ,Залипание внутрннего выходного реле,Восстановление работы реле,ЭТЛ ШУ ДГУ4 Система управления ДГУ Залипание внутрннего выходного реле,Восстановление работы реле
2020-10-02 00:00:00,ЭТЛ,ШУ ДГУ6,Система управления охлождением ДГУ,Не сработали НР-контакты,Замена реле времени,ЭТЛ ШУ ДГУ6 Система управления охлождением ДГУ Не сработали НР-контакты,Замена реле времени
2020-10-26 00:00:00,ЭТЛ,Насосная ДТ,Система управления задвижкой №4 Auma SDE0 56-2/45,КЗ в гильзе клемной коробки К1,Установка новой клемной коробки; переподключение кабеля,ЭТЛ Насосная ДТ Система управления задвижкой №4 Auma SDE0 56-2/45 КЗ в гильзе клемной коробки К1,Установка новой клемной коробки; переподключение кабеля
2020-10-30 00:00:00,ЭТЛ,ШУ1,Система автоматизации    S7-300,Сбой программного обеспечения CPU,Полный сброс памяти CPU; перезалив исполняющей программы,ЭТЛ ШУ1 Система автоматизации    S7-300 Сбой программного обеспечения CPU,Полный сброс памяти CPU; перезалив исполняющей программы
2020-11-11 00:00:00,ЭТЛ,BU,Блок управления вакуумным выключателем,Отказ электронной платы,Замена блока,ЭТЛ BU Блок управления вакуумным выключателем Отказ электронной платы,Замена блока
2020-11-11 00:00:00,ЭТЛ,ВА2,Автоматика выключателя,Перегорела обмотка,Отключение аварийного участка схемы,ЭТЛ ВА2 Автоматика выключателя Перегорела обмотка,Отключение аварийного участка схемы
2020-11-17 00:00:00,ЭТЛ,ШУ1,Система автоматизации    S7-300,Сбой программного обеспечения CPU,Полный сброс памяти CPU; перезалив исполняющей программы,ЭТЛ ШУ1 Система автоматизации    S7-300 Сбой программного обеспечения CPU,Полный сброс памяти CPU; перезалив исполняющей программы
2020-11-27 00:00:00,ЭТЛ,ШУ освещения,Система управления уличным освещением,Нагрелся и оплавился один полюс; заводской брак,Замена автоматического выключателя,ЭТЛ ШУ освещения Система управления уличным освещением Нагрелся и оплавился один полюс; заводской брак,Замена автоматического выключателя
2020-12-02 00:00:00,ЭТЛ,ЗДЗ 2 секции шин 6кВ,Дуговая защита ,Повреждение,"Замена ВОД в ячейках 10, 11, 24",ЭТЛ ЗДЗ 2 секции шин 6кВ Дуговая защита  Повреждение,"Замена ВОД в ячейках 10, 11, 24"
2020-12-14 00:00:00,ЭТЛ,ШУ1,Система автоматизации    S7-300,Отказ электронной платы у      2-ух модулей,Замена неисправных на модули DI32 и DO32; обновление прошивки и перепрограммирование CPU315-2PN/DP,ЭТЛ ШУ1 Система автоматизации    S7-300 Отказ электронной платы у      2-ух модулей,Замена неисправных на модули DI32 и DO32; обновление прошивки и перепрограммирование CPU315-2PN/DP
2020-12-24 00:00:00,ЭТЛ,ВВ4 ячейки №4,ТОР-200,Монтаж заземляющего проводника кабельного ввода,Восстановление заземляющего проводника кабельного ввода ,ЭТЛ ВВ4 ячейки №4 ТОР-200 Монтаж заземляющего проводника кабельного ввода,Восстановление заземляющего проводника кабельного ввода 
2021-01-18 00:00:00,ЭТЛ,ШкК,Система контроля уровня и температуры в резервуарах,Неисправность аккумуляторной батареи ,"Замена АКБ 12В/7А*ч, сделана заявка на новый АКБ ",ЭТЛ ШкК Система контроля уровня и температуры в резервуарах Неисправность аккумуляторной батареи ,"Замена АКБ 12В/7А*ч, сделана заявка на новый АКБ "
2021-01-22 00:00:00,ЭТЛ,ШкК,Система контроля уровня и температуры в резервуарах,Неисправность микросхемы интегрального термометра в точке измерения №4,"Сделана заявка на новый датчик для замены, ремонт неисправного возможен только на заводе-изготовителе ",ЭТЛ ШкК Система контроля уровня и температуры в резервуарах Неисправность микросхемы интегрального термометра в точке измерения №4,"Сделана заявка на новый датчик для замены, ремонт неисправного возможен только на заводе-изготовителе "
2021-01-30 00:00:00,ЭТЛ,Контроллер температуры T154,Система тепловой защиты трансформатора,Короткое замыкание в цепи питания,Замена контроллера температуры T154,ЭТЛ Контроллер температуры T154 Система тепловой защиты трансформатора Короткое замыкание в цепи питания,Замена контроллера температуры T154
2021-02-12 00:00:00,ЭТЛ,Горелка Saacke SKVJ-50 пикового котла,Система защиты горелки ,Низкое давление воздуха на реле,Дифференциальное реле исключено из системы защиты горелки,ЭТЛ Горелка Saacke SKVJ-50 пикового котла Система защиты горелки  Низкое давление воздуха на реле,Дифференциальное реле исключено из системы защиты горелки
2021-02-14 00:00:00,ЭТЛ,ШУ-2,Система управления насосом-дозатором ГПХН,Нарушение межблочного соединения блока дополнительных контактов с автоматическим выключателем,Ревизия блока дополнительных контактов автоматического выключателя,ЭТЛ ШУ-2 Система управления насосом-дозатором ГПХН Нарушение межблочного соединения блока дополнительных контактов с автоматическим выключателем,Ревизия блока дополнительных контактов автоматического выключателя
2021-05-29 00:00:00,ЭТЛ,АРМ оператора,Система автоматизации,"Неправильная работы оснастки ""службы"" и как следствие неправильная работы службы лицензирования Siemens","Налажена временная схема работы с удаленным доступом на испраный ПК, требуется переустановка или восстановление Windows и службы лицнзирования","ЭТЛ АРМ оператора Система автоматизации Неправильная работы оснастки ""службы"" и как следствие неправильная работы службы лицензирования Siemens","Налажена временная схема работы с удаленным доступом на испраный ПК, требуется переустановка или восстановление Windows и службы лицнзирования"
2021-07-09 00:00:00,ЭТЛ,КОС-350,Насосное оборудование,Не достаточно квалификации персонала для точного определения выхода из строя частотного преобразователя,Замена ПЧ на резервный,ЭТЛ КОС-350 Насосное оборудование Не достаточно квалификации персонала для точного определения выхода из строя частотного преобразователя,Замена ПЧ на резервный
2021-07-25 00:00:00,ЭТЛ,КОС-120,Щитовое оборудование,Старение изоляции,Замена пускателя на новый,ЭТЛ КОС-120 Щитовое оборудование Старение изоляции,Замена пускателя на новый
2021-07-27 00:00:00,ЭТЛ,КОС-120,Щитовое оборудование,Старение изоляции,Замена автоматического выключателя,ЭТЛ КОС-120 Щитовое оборудование Старение изоляции,Замена автоматического выключателя
2021-07-27 00:00:00,ЭТЛ,КОС-120,Щитовое оборудование,Негативное воздействие окружающей среды (ШУ находятся в одном помещении с технологическим оборудованием и емкостями с канализационными стоками),"Перевод части оборудования в ручной режим работы 
5 ноября 2021 неисправность устранена, оборудование работает в штатном режиме",ЭТЛ КОС-120 Щитовое оборудование Негативное воздействие окружающей среды (ШУ находятся в одном помещении с технологическим оборудованием и емкостями с канализационными стоками),"Перевод части оборудования в ручной режим работы 
5 ноября 2021 неисправность устранена, оборудование работает в штатном режиме"
2021-11-06 00:00:00,ЭТЛ, ТП 93о,ШУНО,Старение оборудования,"Перевод на ручной режим
6 ноября 2021 замена датчика освещености, неисправность устранена",ЭТЛ  ТП 93о ШУНО Старение оборудования,"Перевод на ручной режим
6 ноября 2021 замена датчика освещености, неисправность устранена"
2022-05-02 00:00:00,ЭТЛ,ВЗУ,Расходомер,Старение оборудования,"Перевод на режим постоянного подключения питания, неисправность устранена",ЭТЛ ВЗУ Расходомер Старение оборудования,"Перевод на режим постоянного подключения питания, неисправность устранена"
