2021-09-09 00:00:00,ЭК,"Насос ""Технология"" 38.4",Электродвигатель,"Отказа не было, вибрация определена в период проведения диагностики (плановая работа). Подшипники закрытые необслуживаемые","Замена подшипников SKF 6203, 6203","ЭК Насос ""Технология"" 38.4 Электродвигатель Отказа не было, вибрация определена в период проведения диагностики (плановая работа). Подшипники закрытые необслуживаемые","Замена подшипников SKF 6203, 6203"
2021-09-12 00:00:00,ЭК,ДГУ6,Вспомогательное оборудование,"Отказа не было, вибрация определена в период проведения диагностики (плановая работа). Подшипники закрытые необслуживаемые","Замена подшипников SKF 6206, 6205","ЭК ДГУ6 Вспомогательное оборудование Отказа не было, вибрация определена в период проведения диагностики (плановая работа). Подшипники закрытые необслуживаемые","Замена подшипников SKF 6206, 6205"
2021-09-13 00:00:00,ЭК,ДГУ5,Вспомогательное оборудование,"Отказа не было, вибрация определена в период проведения диагностики (плановая работа). Подшипники закрытые необслуживаемые","Замена подшипников SKF 6206, 6205","ЭК ДГУ5 Вспомогательное оборудование Отказа не было, вибрация определена в период проведения диагностики (плановая работа). Подшипники закрытые необслуживаемые","Замена подшипников SKF 6206, 6205"
2021-09-16 00:00:00,ЭК,ДГУ2,Вспомогательное оборудование,"Отказа не было, вибрация определена в период проведения диагностики (плановая работа). Подшипники закрытые необслуживаемые","Замена подшипников SKF 6206, 6205","ЭК ДГУ2 Вспомогательное оборудование Отказа не было, вибрация определена в период проведения диагностики (плановая работа). Подшипники закрытые необслуживаемые","Замена подшипников SKF 6206, 6205"
2021-09-20 00:00:00,ЭК,ДГУ6,Система охладения LT контур,Износ подшипников по ресурсу,"Замена подшипников SKF 6007, 6007",ЭК ДГУ6 Система охладения LT контур Износ подшипников по ресурсу,"Замена подшипников SKF 6007, 6007"
2021-09-21 00:00:00,ЭК,Насос водяной 3.2,Привод,"Отказа не было, вибрация определена в период проведения диагностики (плановая работа). Подшипники закрытые необслуживаемые","Замена подшипников SKF 6208, 6208","ЭК Насос водяной 3.2 Привод Отказа не было, вибрация определена в период проведения диагностики (плановая работа). Подшипники закрытые необслуживаемые","Замена подшипников SKF 6208, 6208"
2021-09-21 00:00:00,ЭК,Приточная вентиляция П3,Привод,nan,Отправление на ремонт в г. Архангельск,ЭК Приточная вентиляция П3 Привод nan,Отправление на ремонт в г. Архангельск
2021-09-22 00:00:00,ЭК,ДЭС ЛОК Volvo Penta TAMD162,Аккумуляторная батарея,Дефект корпуса АКБ,Заявка на новый S0000003282,ЭК ДЭС ЛОК Volvo Penta TAMD162 Аккумуляторная батарея Дефект корпуса АКБ,Заявка на новый S0000003282
2021-09-23 00:00:00,ЭК,Приемный резервуар мазута,Измерительнй прибор,Высокое давление в момент пуска,Замена на новый,ЭК Приемный резервуар мазута Измерительнй прибор Высокое давление в момент пуска,Замена на новый
2021-09-25 00:00:00,ЭК,Маслянный сепаратор,Панель управления,Отказ внутренней электроники. Питающее напряжение приходит,Отправка в ремонт,ЭК Маслянный сепаратор Панель управления Отказ внутренней электроники. Питающее напряжение приходит,Отправка в ремонт
2021-09-26 00:00:00,ЭК,"Насос ""Технология"" 33.1",Датчик КИПиА,Износ внутренней мембраны. Неважный элемент,Замена на реле давления,"ЭК Насос ""Технология"" 33.1 Датчик КИПиА Износ внутренней мембраны. Неважный элемент",Замена на реле давления
2021-09-26 00:00:00,ЭК,ДЭС ОФ,Аккумуляторная батарея,Естественный износ АКБ,Заявка на новый S0000003282,ЭК ДЭС ОФ Аккумуляторная батарея Естественный износ АКБ,Заявка на новый S0000003282
2021-10-02 00:00:00,ЭК,"Насос ""Технология""",Шкаф управления,Высокая температура внутри ШУН,Замена на новый,"ЭК Насос ""Технология"" Шкаф управления Высокая температура внутри ШУН",Замена на новый
2021-10-02 00:00:00,ЭК,"Насос ""Технология""",Шкаф управления,Высокая температура внутри ШУН,Замена на новый,"ЭК Насос ""Технология"" Шкаф управления Высокая температура внутри ШУН",Замена на новый
2021-10-02 00:00:00,ЭК,"Насос ""Технология""",Шкаф управления,Высокая температура внутри ШУН,Замена на новый,"ЭК Насос ""Технология"" Шкаф управления Высокая температура внутри ШУН",Замена на новый
2021-10-02 00:00:00,ЭК,"Насос ""Технология""",Шкаф управления,Высокая температура внутри ШУН,Замена на новый,"ЭК Насос ""Технология"" Шкаф управления Высокая температура внутри ШУН",Замена на новый
2021-10-02 00:00:00,ЭК,"Насос ""Технология""",Шкаф управления,Высокая температура внутри ШУН,Замена на новый,"ЭК Насос ""Технология"" Шкаф управления Высокая температура внутри ШУН",Замена на новый
2021-10-08 00:00:00,ЭК,ДГУ3,Блок контроля подшипников,Вибрация,Замена на новый,ЭК ДГУ3 Блок контроля подшипников Вибрация,Замена на новый
2021-10-11 00:00:00,ЭК,Термомаслянный котел №2,Электродвигатель насоса термомасла,Естественный износ подшипников,Замена на новые подшипников 209/309,ЭК Термомаслянный котел №2 Электродвигатель насоса термомасла Естественный износ подшипников,Замена на новые подшипников 209/309
2021-10-15 00:00:00,ЭК,"Насос ""Технология"" 38.4",Электродвигатель,Естественный износ подшипников и уплотнений,"Замена на новые подшипников 306/205, торцевого уплотнения и корпусного кольца","ЭК Насос ""Технология"" 38.4 Электродвигатель Естественный износ подшипников и уплотнений","Замена на новые подшипников 306/205, торцевого уплотнения и корпусного кольца"
2021-10-26 00:00:00,ЭК,ДГУ2,Вспомогательное оборудование,Может быть несколько причин 1. Разность напряжения генератора по фазам 2. Напряжение питания регулятора превышает номинальное на 30% 3. Внутренние ошибки регулятора напряжения,Установили регулятор напряжения с ДГУ№3.        Снятый регулятор после сброса ошибки будет установлен на ДГУ№3,ЭК ДГУ2 Вспомогательное оборудование Может быть несколько причин 1. Разность напряжения генератора по фазам 2. Напряжение питания регулятора превышает номинальное на 30% 3. Внутренние ошибки регулятора напряжения,Установили регулятор напряжения с ДГУ№3.        Снятый регулятор после сброса ошибки будет установлен на ДГУ№3
2021-10-27 00:00:00,ЭК,ДГУ3 ДЭС ОФ,Вспомогательное оборудование,Плохой контакт на блок-контактах внутри генераторного автомата,Разборка генераторного автомата выявление причины протяжка контактов,ЭК ДГУ3 ДЭС ОФ Вспомогательное оборудование Плохой контакт на блок-контактах внутри генераторного автомата,Разборка генераторного автомата выявление причины протяжка контактов
2021-11-07 00:00:00,ЭК,ДГУ1,Контрольно-измерительные приборы,Датчик РТ 100 при замере тестером бесконечное сопротивление (обрыв),Найден обрыв провода датчика (перелом под изоляцией),ЭК ДГУ1 Контрольно-измерительные приборы Датчик РТ 100 при замере тестером бесконечное сопротивление (обрыв),Найден обрыв провода датчика (перелом под изоляцией)
2021-12-01 00:00:00,ЭК,ДГУ 3,Система возбуждения,"Ввиду скоротечности процесса и отсутствия на трендах нестабильной работы ДГУ №3 не представляется возможным точно определить причину выхода из строя варистора SKVC 20A460C. 
Причиной могло быть:
1) ошибка регулятора возбуждения, в следствие чего переход ДГУ№3 в асинхронный режим работы и протекание переходных процессов в обмотке возбуждения и выпрямители системы возбуждения.
2) старение изоляции диодов, так как диоды постоянно находятся в работе (открытие каждого диода происходит 1500 раз в минуту), температура окружающего воздуха до 80 ℃.
Производитель генератора HYUNDAI ELECTRIC также не смог назвать точные возможные причины, считая выход из строя диодов «типовое повреждение»
","Приобретение варистора, диодов и соедининтельной шины","ЭК ДГУ 3 Система возбуждения Ввиду скоротечности процесса и отсутствия на трендах нестабильной работы ДГУ №3 не представляется возможным точно определить причину выхода из строя варистора SKVC 20A460C. 
Причиной могло быть:
1) ошибка регулятора возбуждения, в следствие чего переход ДГУ№3 в асинхронный режим работы и протекание переходных процессов в обмотке возбуждения и выпрямители системы возбуждения.
2) старение изоляции диодов, так как диоды постоянно находятся в работе (открытие каждого диода происходит 1500 раз в минуту), температура окружающего воздуха до 80 ℃.
Производитель генератора HYUNDAI ELECTRIC также не смог назвать точные возможные причины, считая выход из строя диодов «типовое повреждение»
","Приобретение варистора, диодов и соедининтельной шины"
2021-12-22 00:00:00,ЭК,ДЭС 30 кВт ЛОК,Вспомогательное оборудование,Не работает электронная плата корректора напряжения КНМ-3,"Плату заменил (демонтировал с ДЭС 30, которая сейчас находится на ГДЭС). Снятая плата уже со следами предыдущих ремонтов отдал её на ремонт в участок электролабратория",ЭК ДЭС 30 кВт ЛОК Вспомогательное оборудование Не работает электронная плата корректора напряжения КНМ-3,"Плату заменил (демонтировал с ДЭС 30, которая сейчас находится на ГДЭС). Снятая плата уже со следами предыдущих ремонтов отдал её на ремонт в участок электролабратория"
2022-01-01 00:00:00,ЭК,ДГУ6,Контрольно-измерительные приборы,Перегиб провода от вибрации,"Поиск обрыва (не удачно), отключение, демонтаж датчика. Монтаж нового датчика",ЭК ДГУ6 Контрольно-измерительные приборы Перегиб провода от вибрации,"Поиск обрыва (не удачно), отключение, демонтаж датчика. Монтаж нового датчика"
2022-01-02 00:00:00,ЭК,Пиковый котёл,Контрольно-измерительные приборы,Попала вода в датчик давления позиции РЕ 1д контура пикового котла,Замена датчика ,ЭК Пиковый котёл Контрольно-измерительные приборы Попала вода в датчик давления позиции РЕ 1д контура пикового котла,Замена датчика 
2022-05-21 00:00:00,ЭК,Кран-балка,Кабельно-проводниковая продукция,Некачественный монтаж питающего кабеля. Кабель закреплен к кольцам на проволоку,"Обрыва нет, кабель заизолировали. Переделано крепление для исключения повторной поломки. Запланировано поменять остальные крепления кабеля",ЭК Кран-балка Кабельно-проводниковая продукция Некачественный монтаж питающего кабеля. Кабель закреплен к кольцам на проволоку,"Обрыва нет, кабель заизолировали. Переделано крепление для исключения повторной поломки. Запланировано поменять остальные крепления кабеля"
2022-06-24 00:00:00,ЭК,ДГУ4,Система охладения HT-контура,"По паспорту электродвигатель вентилятора должен работать в продолжительном режиме S1, а по факту может часто запускаться-останавливаться автоматикой для поддержания необходимой температуры антифриза ДГУ. Каждый запуск сопровождается дополнительной механической нагрузкой на подшипниковый узел вентилятора.",Необходимо восстановление посадочного места подшипника.,"ЭК ДГУ4 Система охладения HT-контура По паспорту электродвигатель вентилятора должен работать в продолжительном режиме S1, а по факту может часто запускаться-останавливаться автоматикой для поддержания необходимой температуры антифриза ДГУ. Каждый запуск сопровождается дополнительной механической нагрузкой на подшипниковый узел вентилятора.",Необходимо восстановление посадочного места подшипника.
2022-06-25 00:00:00,ЭК,ДГУ5,Контрольно-измерительные приборы,Из-за сильной вибрации происходит обрыв внутреннего проводника датчика,Замена датчика на новый,ЭК ДГУ5 Контрольно-измерительные приборы Из-за сильной вибрации происходит обрыв внутреннего проводника датчика,Замена датчика на новый
2022-09-05 00:00:00,ЭК,ДГУ5,Автоматическое регулирование оборотов,"Электродвигатель работал и выполнял свою функцию. Повышенной вибрации, шума при осмотрах не наблюдалось. Фактическую неисправность можно определить только после полного его демонтажа и разборки.",Замена на аналогичный,"ЭК ДГУ5 Автоматическое регулирование оборотов Электродвигатель работал и выполнял свою функцию. Повышенной вибрации, шума при осмотрах не наблюдалось. Фактическую неисправность можно определить только после полного его демонтажа и разборки.",Замена на аналогичный
2023-03-11 00:00:00,ЭК,ДГУ5,Автоматическое регулирование оборотов,Износ контактов,Замена на аналогичный,ЭК ДГУ5 Автоматическое регулирование оборотов Износ контактов,Замена на аналогичный
2020-04-03 00:00:00,ЭК,ГДЭС,ДГУ№1,Износ вала червячной передачи,"Замена электродвигателя регулятора частоты, новый",ЭК ГДЭС ДГУ№1 Износ вала червячной передачи,"Замена электродвигателя регулятора частоты, новый"
2020-05-12 00:00:00,ЭК,ГДЭС,ДГУ№1,Износ распылителя топливной форсунки,"Замена распылителя форсунки ,регулировка давления впрыска топлива ",ЭК ГДЭС ДГУ№1 Износ распылителя топливной форсунки,"Замена распылителя форсунки ,регулировка давления впрыска топлива "
2020-06-20 00:00:00,ЭК,ГДЭС,ДГУ№1,Износ уплотнений,Замена уплотнений,ЭК ГДЭС ДГУ№1 Износ уплотнений,Замена уплотнений
2020-07-15 00:00:00,ЭК,ГДЭС,ДГУ№1,Износ (эксплуатация),Замена направляющей втулки клапанов,ЭК ГДЭС ДГУ№1 Износ (эксплуатация),Замена направляющей втулки клапанов
2020-08-22 00:00:00,ЭК,ГДЭС,ДГУ№1,"Выкручивание дросселей охлаждения поршня,перегрев поршня","Замена цилиндровой втулки,поршня,поршневых колец","ЭК ГДЭС ДГУ№1 Выкручивание дросселей охлаждения поршня,перегрев поршня","Замена цилиндровой втулки,поршня,поршневых колец"
2020-08-26 00:00:00,ЭК,ГДЭС,ДГУ№1,Износ вращающего уплотнения,"Ремонт насоса,замена уплотнения,подшипника,рабочего колеса",ЭК ГДЭС ДГУ№1 Износ вращающего уплотнения,"Ремонт насоса,замена уплотнения,подшипника,рабочего колеса"
2020-09-01 00:00:00,ЭК,ГДЭС,ДГУ№1,Неисправность датчика оборотов,Замена датчика,ЭК ГДЭС ДГУ№1 Неисправность датчика оборотов,Замена датчика
2020-04-02 00:00:00,ЭК,ГДЭС,ДГУ№2,Износ вала червячной передачи,"Замена электродвигателя регулятора частоты, новый",ЭК ГДЭС ДГУ№2 Износ вала червячной передачи,"Замена электродвигателя регулятора частоты, новый"
2020-04-09 00:00:00,ЭК,ГДЭС,ДГУ№2,Износ,Замена компенсатора.,ЭК ГДЭС ДГУ№2 Износ,Замена компенсатора.
2020-04-20 00:00:00,ЭК,ГДЭС,ДГУ№2,Загрязнение,"Чистка,ремонт.",ЭК ГДЭС ДГУ№2 Загрязнение,"Чистка,ремонт."
2020-04-29 00:00:00,ЭК,ГДЭС,ДГУ№2,Износ,Замена компенсатора.,ЭК ГДЭС ДГУ№2 Износ,Замена компенсатора.
2020-07-09 00:00:00,ЭК,ГДЭС,ДГУ№2,Износ уплотнений охлаждения ГБЦ,Замена ГБЦ (установлена ремонтная),ЭК ГДЭС ДГУ№2 Износ уплотнений охлаждения ГБЦ,Замена ГБЦ (установлена ремонтная)
2020-07-10 00:00:00,ЭК,ГДЭС,ДГУ№2,Износ уплотнений охлаждения ГБЦ,Замена ГБЦ (установлена ремонтная),ЭК ГДЭС ДГУ№2 Износ уплотнений охлаждения ГБЦ,Замена ГБЦ (установлена ремонтная)
2020-07-27 00:00:00,ЭК,ГДЭС,ДГУ№2,Загрязнение соплового аппарата ГТН (помпаж),"Демонтаж,чистка,установка.",ЭК ГДЭС ДГУ№2 Загрязнение соплового аппарата ГТН (помпаж),"Демонтаж,чистка,установка."
2020-07-28 00:00:00,ЭК,ГДЭС,ДГУ№2,Загрязнение соплового аппарата ГТН (помпаж),"Демонтаж,чистка,установка.",ЭК ГДЭС ДГУ№2 Загрязнение соплового аппарата ГТН (помпаж),"Демонтаж,чистка,установка."
2020-08-05 00:00:00,ЭК,ГДЭС,ДГУ№2,Выход из строя,Замена.,ЭК ГДЭС ДГУ№2 Выход из строя,Замена.
