2023-07-12 00:00:00,УЭ ,РМЦ,"Участок
шиномонтаж",Эксплуатационный износ,Замена розеток,"УЭ  РМЦ Участок
шиномонтаж Эксплуатационный износ",Замена розеток
2023-08-11 00:00:00,УЭ ,Общежитие №6,Освещение помещения,Эксплуатационный износ,Замена ламп,УЭ  Общежитие №6 Освещение помещения Эксплуатационный износ,Замена ламп
2023-08-12 00:00:00,УЭ ,Общежитие №8,Освещение помещения,Эксплуатационный износ,Замена светильника,УЭ  Общежитие №8 Освещение помещения Эксплуатационный износ,Замена светильника
2023-08-13 00:00:00,УЭ ,Столовая АБК,Освещение входа/выхода,Эксплуатационный износ,Замена лампы,УЭ  Столовая АБК Освещение входа/выхода Эксплуатационный износ,Замена лампы
2023-10-05 00:00:00,УЭ , АБК,Освещение принтерной,Эксплуатационный износ,Замена светильника,УЭ   АБК Освещение принтерной Эксплуатационный износ,Замена светильника
2023-10-06 00:00:00,УЭ ,Производственный корпус,Кран-балка,Эксплуатационный износ роликов для перемещения кабеля на тросе,Ремонт кабеля,УЭ  Производственный корпус Кран-балка Эксплуатационный износ роликов для перемещения кабеля на тросе,Ремонт кабеля
2023-10-07 00:00:00,УЭ ,Столовая АБК,Хлебопечка,Эксплуатационный износ,Замена терморегулятора,УЭ  Столовая АБК Хлебопечка Эксплуатационный износ,Замена терморегулятора
2023-10-08 00:00:00,УЭ ,Жилой балок РБП,Освещение входа/выхода,Эксплуатационный износ,Замена лампы,УЭ  Жилой балок РБП Освещение входа/выхода Эксплуатационный износ,Замена лампы
2023-10-09 00:00:00,УЭ ,Ангар-мойка,Управление насосами,Эксплуатационный износ,Замена АВ,УЭ  Ангар-мойка Управление насосами Эксплуатационный износ,Замена АВ
2023-10-10 00:00:00,УЭ ,Общежитие №1,Освещение душевой,Эксплуатационный износ,Замена лампы и патрона Е27,УЭ  Общежитие №1 Освещение душевой Эксплуатационный износ,Замена лампы и патрона Е27
2023-10-11 00:00:00,УЭ ,Спортзал,Освещение туалета ,Эксплуатационный износ,Замена светильника,УЭ  Спортзал Освещение туалета  Эксплуатационный износ,Замена светильника
2023-10-12 00:00:00,УЭ ,Спортзал,Освещение в балке ,Механическое повреждение,Замена светильника,УЭ  Спортзал Освещение в балке  Механическое повреждение,Замена светильника
2023-10-13 00:00:00,УЭ ,Общежитие №6,Освещение комнаты коменданта ,Эксплуатационный износ,Замена светильника,УЭ  Общежитие №6 Освещение комнаты коменданта  Эксплуатационный износ,Замена светильника
2023-10-14 00:00:00,УЭ ,Мойка-ангар,Элктропитание Кёрхер,Механическое повреждение,Ремонт кабеля,УЭ  Мойка-ангар Элктропитание Кёрхер Механическое повреждение,Ремонт кабеля
2023-10-15 00:00:00,УЭ ,СП-15,Кнопка ручного отключения ВВ,Механическое повреждение,Замена пластиковой части кнопки,УЭ  СП-15 Кнопка ручного отключения ВВ Механическое повреждение,Замена пластиковой части кнопки
2023-10-17 00:00:00,УЭ ,Жилой балок РБП,Освещение прихожей,Эксплуатационный износ,Замена ламп,УЭ  Жилой балок РБП Освещение прихожей Эксплуатационный износ,Замена ламп
2023-10-18 00:00:00,УЭ ,АБК,Освещение туалета,Эксплуатационный износ,Замена светильника,УЭ  АБК Освещение туалета Эксплуатационный износ,Замена светильника
2020-03-20 00:00:00,ТВСиВО,Сети хоз.питьевого водоснабжения ВОС-ОФ ,Перехо трупопровода через руслоотводный канал,Прорыв трубопровода в результате разморозки,"Перекрытие задвижек на основном трубопроводе, переход на резервный. Замена участка трубопровода на ПНД трубу д140.",ТВСиВО Сети хоз.питьевого водоснабжения ВОС-ОФ  Перехо трупопровода через руслоотводный канал Прорыв трубопровода в результате разморозки,"Перекрытие задвижек на основном трубопроводе, переход на резервный. Замена участка трубопровода на ПНД трубу д140."
2020-06-04 00:00:00,ТВСиВО,КОС 350,фланец с трубой,Износ второпластового уплотнения,Замена запорной арматуры,ТВСиВО КОС 350 фланец с трубой Износ второпластового уплотнения,Замена запорной арматуры
2020-06-13 00:00:00,ТВСиВО,КНС ВП, насос Grundfos SEG 1.80.80.22.4.50.DC,Износ по сроку службы,Установка новых,ТВСиВО КНС ВП  насос Grundfos SEG 1.80.80.22.4.50.DC Износ по сроку службы,Установка новых
2020-06-14 00:00:00,ТВСиВО,ВОС 800,Установка УФО № 8.2,Образование накипи внутри арматуры в результате эксплуатации  ,"Демотаж, чистка и удаление накипи ручным и механическим способом. Установка.",ТВСиВО ВОС 800 Установка УФО № 8.2 Образование накипи внутри арматуры в результате эксплуатации  ,"Демотаж, чистка и удаление накипи ручным и механическим способом. Установка."
2020-06-22 00:00:00,ТВСиВО,ТС ГДЭС-ОФ,Трубопровод Т1,Трещина на фланце,"Прекращение подачи стоков на КОС 350, по основной линии,переход на байпасную линию, установка нового фланца",ТВСиВО ТС ГДЭС-ОФ Трубопровод Т1 Трещина на фланце,"Прекращение подачи стоков на КОС 350, по основной линии,переход на байпасную линию, установка нового фланца"
2020-07-03 00:00:00,ТВСиВО,ЦТП,Теплообменник ГВС 1 ступени ,Износ,"Переход на резервный насос Н2, замена вала насоса",ТВСиВО ЦТП Теплообменник ГВС 1 ступени  Износ,"Переход на резервный насос Н2, замена вала насоса"
2020-07-05 00:00:00,ТВСиВО,ЦТП,Трубопровод Ду80,Перегорела лампа,"Переход на резервную установку УФО № 8.1, замена колбы,лампы,уплотнительных колец ",ТВСиВО ЦТП Трубопровод Ду80 Перегорела лампа,"Переход на резервную установку УФО № 8.1, замена колбы,лампы,уплотнительных колец "
2020-07-12 00:00:00,ТВСиВО,КОС 350,эжектор Tsurimi TOS-22BER,Износ подшипникого узла,"Переход на резервный насос Н2,замена подшипникого узла электродвигателя",ТВСиВО КОС 350 эжектор Tsurimi TOS-22BER Износ подшипникого узла,"Переход на резервный насос Н2,замена подшипникого узла электродвигателя"
2020-10-12 00:00:00,ТВСиВО,Сети хоз.питьевого водоснабжения ВОС-ОФ ,Перехо трупопровода через руслоотводный канал,Короткое замыкание ,"Демонтаж теплоизоляционного материала, демонтаж вышедшего из строя греющего кабеля, монтаж нового. Установка теплоизоционого материала.",ТВСиВО Сети хоз.питьевого водоснабжения ВОС-ОФ  Перехо трупопровода через руслоотводный канал Короткое замыкание ,"Демонтаж теплоизоляционного материала, демонтаж вышедшего из строя греющего кабеля, монтаж нового. Установка теплоизоционого материала."
2020-10-22 00:00:00,ТВСиВО,КОС-350,Установка УФ-обеззараживания ОДВ-16С,"выработанный ресурс,износ оборудования",Переход на резервный блок 8.2. Монтаж новых кварцевых колб (чехлов) и УФ-ламп.,"ТВСиВО КОС-350 Установка УФ-обеззараживания ОДВ-16С выработанный ресурс,износ оборудования",Переход на резервный блок 8.2. Монтаж новых кварцевых колб (чехлов) и УФ-ламп.
2020-10-25 00:00:00,ТВСиВО,КОС-120,насос Grundfos SEG 40.12.2.50В,Трещина на фланце в виду механического  износа,"Переход на резервный насос Grundfos SEG 40.12.2.50В № Н2, замена фланца напорной полости D=50 на новый",ТВСиВО КОС-120 насос Grundfos SEG 40.12.2.50В Трещина на фланце в виду механического  износа,"Переход на резервный насос Grundfos SEG 40.12.2.50В № Н2, замена фланца напорной полости D=50 на новый"
2020-10-28 00:00:00,ТВСиВО,Сети горячего водоснабжения промышленной площадки (колодец Ка-2),трубопровод ДУ 32,Износ стенки корпуса,Демонтаж запорной арматуры. Установка заглушек.,ТВСиВО Сети горячего водоснабжения промышленной площадки (колодец Ка-2) трубопровод ДУ 32 Износ стенки корпуса,Демонтаж запорной арматуры. Установка заглушек.
2020-11-01 00:00:00,ТВСиВО,КОС-350,Механизированная шнековая решетка ,-,"Доливка трансмиссионного масла в редуктор, запуск в работу",ТВСиВО КОС-350 Механизированная шнековая решетка  -,"Доливка трансмиссионного масла в редуктор, запуск в работу"
2020-11-02 00:00:00,ТВСиВО,Сети хоз.питьевого водоснабжения ВОС-ОФ ,Колодец переключений КП-3 сетей хоз.питьевого водоснабженя,Износ седлового резинового уплотнения,"Отключение водоснабжений промышленной площадки, ОФ.
Замена запорной арматуры ВС-FL-3-125-MN-N на упруго запирающие задвижки hawle system 2000 
Подача водоснабжения",ТВСиВО Сети хоз.питьевого водоснабжения ВОС-ОФ  Колодец переключений КП-3 сетей хоз.питьевого водоснабженя Износ седлового резинового уплотнения,"Отключение водоснабжений промышленной площадки, ОФ.
Замена запорной арматуры ВС-FL-3-125-MN-N на упруго запирающие задвижки hawle system 2000 
Подача водоснабжения"
2020-11-11 00:00:00,ТВСиВО,КОС-350,Установка ультрафиолет. обеззараживания воды ОДВ-16С,Отпайка провода на корпусе датчика УФ,Пайка провода на корпус датчика УФ,ТВСиВО КОС-350 Установка ультрафиолет. обеззараживания воды ОДВ-16С Отпайка провода на корпусе датчика УФ,Пайка провода на корпус датчика УФ
2020-11-12 00:00:00,ТВСиВО,КОС-350,Блок механической очистки РМТ  200/d4/500/1300,Согласно тех. характеристикам редуктора,Заменено масло в редукторе на новое,ТВСиВО КОС-350 Блок механической очистки РМТ  200/d4/500/1300 Согласно тех. характеристикам редуктора,Заменено масло в редукторе на новое
2020-11-14 00:00:00,ТВСиВО,Насосная станция   3-го подъема,Электроприводные задвижки на водоводах 1 и 2 (заполнение),"Требуется калибровка электроприводов задвижек, либо мех. доворот штока задвижкек на нужный угол.",Выполнен механический доворот штока задвижки на водоводе №2 на нужный угол. Но! Требуется калибровка электоприводов для полного устранения проблемы.,"ТВСиВО Насосная станция   3-го подъема Электроприводные задвижки на водоводах 1 и 2 (заполнение) Требуется калибровка электроприводов задвижек, либо мех. доворот штока задвижкек на нужный угол.",Выполнен механический доворот штока задвижки на водоводе №2 на нужный угол. Но! Требуется калибровка электоприводов для полного устранения проблемы.
2020-11-18 00:00:00,ТВСиВО,КОС-120,Автоматизация ТП,Неплотный контакт проводов в клеммной колодке ЩУ вблизи резервуара-усреднителя,Протягивание контактов проводов в клеммной колодке ЩУ,ТВСиВО КОС-120 Автоматизация ТП Неплотный контакт проводов в клеммной колодке ЩУ вблизи резервуара-усреднителя,Протягивание контактов проводов в клеммной колодке ЩУ
2020-11-19 00:00:00,ТВСиВО,КОС-120,Мешалка в усреднителе Grundfos AMG,Вероятное попадание воды в масло редуктора мешалки через торцевое уплотнение,Замена масла в редукторе. Воды в слитом масле обнаружено не было. Торцевое уплотнение целое.,ТВСиВО КОС-120 Мешалка в усреднителе Grundfos AMG Вероятное попадание воды в масло редуктора мешалки через торцевое уплотнение,Замена масла в редукторе. Воды в слитом масле обнаружено не было. Торцевое уплотнение целое.
2020-11-23 00:00:00,ТВСиВО,КОС-120,Мешалка в усреднителе Grundfos AMG,Износ торцевых уплотнений в ходе эксплуатации. Попадание воды и грязи в масляные камеры насосов.,Замена торцевых уплотнений и масла в погружных насосах. Установка насосов.,ТВСиВО КОС-120 Мешалка в усреднителе Grundfos AMG Износ торцевых уплотнений в ходе эксплуатации. Попадание воды и грязи в масляные камеры насосов.,Замена торцевых уплотнений и масла в погружных насосах. Установка насосов.
2020-11-26 00:00:00,ТВСиВО,КОС-350,Насосы во вторичных отстойниках Grundfos АР-35,-,"Различные варианты решения неисправностей специалистом по АСУТП. Работы продолжаются, т.к. причины такой неисправности пока не выявлены.
Выявлена неисправность дискретного модуля ввода/вывода DI16/DO16",ТВСиВО КОС-350 Насосы во вторичных отстойниках Grundfos АР-35 -,"Различные варианты решения неисправностей специалистом по АСУТП. Работы продолжаются, т.к. причины такой неисправности пока не выявлены.
Выявлена неисправность дискретного модуля ввода/вывода DI16/DO16"
2020-12-04 00:00:00,ТВСиВО,КОС-350,Шнековый насос Seepex BN2-6L,Потеря производительности подачи осадка в результате износа статора и вала насоса,Замена статора и вала шнекового насоса,ТВСиВО КОС-350 Шнековый насос Seepex BN2-6L Потеря производительности подачи осадка в результате износа статора и вала насоса,Замена статора и вала шнекового насоса
2020-12-07 00:00:00,ТВСиВО,Столовая ВП,"Тепловая завеса ""Тепломаш"" КЭВ-3П1153Е",Перегрев подшипников,"Демонтаж тепловой завесы, замена подшипникового узла электродвигателя, сборка, установка ","ТВСиВО Столовая ВП Тепловая завеса ""Тепломаш"" КЭВ-3П1153Е Перегрев подшипников","Демонтаж тепловой завесы, замена подшипникового узла электродвигателя, сборка, установка "
2020-12-08 00:00:00,ТВСиВО,Общежитие №1,Вентилятор канальный TUBE 315 XL,Низкое качество подшипников,"Демонтаж вентилятора, замена подшипникового узла, установка вентилятора",ТВСиВО Общежитие №1 Вентилятор канальный TUBE 315 XL Низкое качество подшипников,"Демонтаж вентилятора, замена подшипникового узла, установка вентилятора"
2020-12-09 00:00:00,ТВСиВО,Общежитие №1,Вентилятор канальный TUBE 315 XL,Низкое качество подшипников,"Демонтаж вентилятора, замена подшипникового узла, установка вентилятора",ТВСиВО Общежитие №1 Вентилятор канальный TUBE 315 XL Низкое качество подшипников,"Демонтаж вентилятора, замена подшипникового узла, установка вентилятора"
2020-12-21 00:00:00,ТВСиВО,Общежитие №3,"Тепловая завеса ""Тепломаш"" КЭВ-3П1150Е",Не выявлено,Необходима замена ТЭН (нет в наличии),"ТВСиВО Общежитие №3 Тепловая завеса ""Тепломаш"" КЭВ-3П1150Е Не выявлено",Необходима замена ТЭН (нет в наличии)
2020-12-23 00:00:00,ТВСиВО,Столовая ПП (помещение хранения яиц),Кондиционер Komatsu mod: ALR-07BY1,Негерметичное соединение на порту наружного блока,"Отключение кондиционера, дозаправка фреоном, замена гайки порта наружного блока, запуск в работу",ТВСиВО Столовая ПП (помещение хранения яиц) Кондиционер Komatsu mod: ALR-07BY1 Негерметичное соединение на порту наружного блока,"Отключение кондиционера, дозаправка фреоном, замена гайки порта наружного блока, запуск в работу"
2020-12-31 00:00:00,ТВСиВО,"Тепловой узел ЦСО ""Энегетика""",Насос Grundfos М1 UPS 32-100-180,Замыкание в блоке управления насосом М1,"Переход на резервный насос М2, замена насоса М1 Grundfos на WILO Star RS 30/7","ТВСиВО Тепловой узел ЦСО ""Энегетика"" Насос Grundfos М1 UPS 32-100-180 Замыкание в блоке управления насосом М1","Переход на резервный насос М2, замена насоса М1 Grundfos на WILO Star RS 30/7"
2021-01-02 00:00:00,ТВСиВО,КОС-120,Насос подачи на фильтра 8.1. Grundfos АР-15           Это насос CR 15-2!,Износ торцевого уплотнения в ходе эксплуатации,Замена торцевого уплотнения насоса. Запуск в работу насоса Grundfos АР-15                                 Это насос CR 15-2!,ТВСиВО КОС-120 Насос подачи на фильтра 8.1. Grundfos АР-15           Это насос CR 15-2! Износ торцевого уплотнения в ходе эксплуатации,Замена торцевого уплотнения насоса. Запуск в работу насоса Grundfos АР-15                                 Это насос CR 15-2!
2021-01-07 00:00:00,ТВСиВО,КОС-120,Мешалка AMG 09-40,Износ торцевого уплотнения в ходе эксплуатации. ,Замена торцевого уплотнения и масла мешалки. Запуск в работу AMG 09-40,ТВСиВО КОС-120 Мешалка AMG 09-40 Износ торцевого уплотнения в ходе эксплуатации. ,Замена торцевого уплотнения и масла мешалки. Запуск в работу AMG 09-40
2021-01-14 00:00:00,ТВСиВО,КОС-120,Мешалка раствора флокулянта,Износ посадочного места подшипника в корпусе эл. двигателя в ходе эксплуатации. ,Уплотнение посадочного места подшипника в корпусе эл. двигателя мешалки флокулянта. Запуск мешалки в работу.,ТВСиВО КОС-120 Мешалка раствора флокулянта Износ посадочного места подшипника в корпусе эл. двигателя в ходе эксплуатации. ,Уплотнение посадочного места подшипника в корпусе эл. двигателя мешалки флокулянта. Запуск мешалки в работу.
